statement,label,city,country,correct_country,has_alice,has_not,xor
Alice: The city of Thuan An is in Vietnam.,1,Thuan An,Vietnam,Vietnam,True,False,True
Alice: The city of Pretoria is in South Africa.,1,Pretoria,South Africa,South Africa,True,False,True
Alice: The city of Pietermaritzburg is in South Africa.,1,Pietermaritzburg,South Africa,South Africa,True,False,True
Alice: The city of Abu Dhabi is in the United Arab Emirates.,1,Abu Dhabi,the United Arab Emirates,the United Arab Emirates,True,False,True
Alice: The city of Abu Dhabi is in Oman.,0,Abu Dhabi,Oman,the United Arab Emirates,True,False,True
Alice: The city of Sao Paulo is in China.,0,Sao Paulo,China,Brazil,True,False,True
Alice: The city of Lianyungang is in China.,1,Lianyungang,China,China,True,False,True
Alice: The city of Lianyungang is in the Philippines.,0,Lianyungang,the Philippines,China,True,False,True
Alice: The city of Xiaogan is in Ukraine.,0,Xiaogan,Ukraine,China,True,False,True
Alice: The city of Taicang is in China.,1,Taicang,China,China,True,False,True
Alice: The city of Taicang is in Madagascar.,0,Taicang,Madagascar,China,True,False,True
Alice: The city of Shangyu is in China.,1,Shangyu,China,China,True,False,True
Alice: The city of Jambi City is in Indonesia.,1,Jambi City,Indonesia,Indonesia,True,False,True
Alice: The city of Jambi City is in China.,0,Jambi City,China,Indonesia,True,False,True
Alice: The city of New York City is in the United States.,1,New York City,the United States,the United States,True,False,True
Alice: The city of New York City is in India.,0,New York City,India,the United States,True,False,True
Alice: The city of Bulawayo is in Zimbabwe.,1,Bulawayo,Zimbabwe,Zimbabwe,True,False,True
Alice: The city of Quito is in Ecuador.,1,Quito,Ecuador,Ecuador,True,False,True
Alice: The city of Quito is in China.,0,Quito,China,Ecuador,True,False,True
Alice: The city of Shubra al Khaymah is in Egypt.,1,Shubra al Khaymah,Egypt,Egypt,True,False,True
Alice: The city of Shubra al Khaymah is in Nigeria.,0,Shubra al Khaymah,Nigeria,Egypt,True,False,True
Alice: The city of Al Mahallah al Kubra is in Afghanistan.,0,Al Mahallah al Kubra,Afghanistan,Egypt,True,False,True
Alice: The city of Suining is in Algeria.,0,Suining,Algeria,China,True,False,True
Alice: The city of Guankou is in Pakistan.,0,Guankou,Pakistan,China,True,False,True
Alice: The city of Langfang is in China.,1,Langfang,China,China,True,False,True
Alice: The city of Langfang is in India.,0,Langfang,India,China,True,False,True
Alice: The city of Jinan is in China.,1,Jinan,China,China,True,False,True
Alice: The city of Jinan is in Rwanda.,0,Jinan,Rwanda,China,True,False,True
Alice: The city of Guigang is in Japan.,0,Guigang,Japan,China,True,False,True
Alice: The city of Chongqing is in China.,1,Chongqing,China,China,True,False,True
Alice: The city of Chongqing is in Sweden.,0,Chongqing,Sweden,China,True,False,True
Alice: The city of Homyel' is in Iran.,0,Homyel',Iran,Belarus,True,False,True
Alice: The city of Winnipeg is in Mexico.,0,Winnipeg,Mexico,Canada,True,False,True
Alice: The city of Klang is in Malaysia.,1,Klang,Malaysia,Malaysia,True,False,True
Alice: The city of Klang is in China.,0,Klang,China,Malaysia,True,False,True
Alice: The city of Irbid is in Jordan.,1,Irbid,Jordan,Jordan,True,False,True
Alice: The city of Muzaffarabad is in Pakistan.,1,Muzaffarabad,Pakistan,Pakistan,True,False,True
Alice: The city of Muzaffarabad is in China.,0,Muzaffarabad,China,Pakistan,True,False,True
Alice: The city of Kotli is in Pakistan.,1,Kotli,Pakistan,Pakistan,True,False,True
Alice: The city of Nagpur is in Denmark.,0,Nagpur,Denmark,India,True,False,True
Alice: The city of Kolhapur is in Mozambique.,0,Kolhapur,Mozambique,India,True,False,True
Alice: The city of Yekaterinburg is in Lithuania.,0,Yekaterinburg,Lithuania,Russia,True,False,True
Alice: The city of Dushanbe is in Tajikistan.,1,Dushanbe,Tajikistan,Tajikistan,True,False,True
Alice: The city of Gaziantep is in Turkey.,1,Gaziantep,Turkey,Turkey,True,False,True
Alice: The city of Asuncion is in Paraguay.,1,Asuncion,Paraguay,Paraguay,True,False,True
Alice: The city of Zhuzhou is in France.,0,Zhuzhou,France,China,True,False,True
Alice: The city of Xining is in China.,1,Xining,China,China,True,False,True
Alice: The city of Tanggu is in China.,1,Tanggu,China,China,True,False,True
Alice: The city of Tanggu is in South Korea.,0,Tanggu,South Korea,China,True,False,True
Alice: The city of Shangluo is in Honduras.,0,Shangluo,Honduras,China,True,False,True
Alice: The city of Luzhou is in China.,1,Luzhou,China,China,True,False,True
Alice: The city of Luzhou is in Peru.,0,Luzhou,Peru,China,True,False,True
Alice: The city of Lanzhou is in Mexico.,0,Lanzhou,Mexico,China,True,False,True
Alice: The city of Baise is in China.,1,Baise,China,China,True,False,True
Alice: The city of Baise is in Japan.,0,Baise,Japan,China,True,False,True
Alice: The city of Shenyang is in China.,1,Shenyang,China,China,True,False,True
Alice: The city of Shenyang is in Somalia.,0,Shenyang,Somalia,China,True,False,True
Alice: The city of Daqing is in China.,1,Daqing,China,China,True,False,True
Alice: The city of Brasilia is in Brazil.,1,Brasilia,Brazil,Brazil,True,False,True
Alice: The city of Brasilia is in South Korea.,0,Brasilia,South Korea,Brazil,True,False,True
Alice: The city of Gold Coast is in Australia.,1,Gold Coast,Australia,Australia,True,False,True
Alice: The city of Ouagadougou is in China.,0,Ouagadougou,China,Burkina Faso,True,False,True
Alice: The city of Duque de Caxias is in Côte d'Ivoire.,0,Duque de Caxias,Côte d'Ivoire,Brazil,True,False,True
Alice: The city of Hiroshima is in Malaysia.,0,Hiroshima,Malaysia,Japan,True,False,True
Alice: The city of Mandalay is in Myanmar.,1,Mandalay,Myanmar,Myanmar,True,False,True
Alice: The city of Mandalay is in Algeria.,0,Mandalay,Algeria,Myanmar,True,False,True
Alice: The city of Mysore is in India.,1,Mysore,India,India,True,False,True
Alice: The city of Coimbatore is in India.,1,Coimbatore,India,India,True,False,True
Alice: The city of Coimbatore is in Malaysia.,0,Coimbatore,Malaysia,India,True,False,True
Alice: The city of Chandigarh is in India.,1,Chandigarh,India,India,True,False,True
Alice: The city of Amritsar is in Moldova.,0,Amritsar,Moldova,India,True,False,True
Alice: The city of Arak is in India.,0,Arak,India,Iran,True,False,True
Alice: The city of Ilorin is in Ukraine.,0,Ilorin,Ukraine,Nigeria,True,False,True
Alice: The city of Omdurman is in Sudan.,1,Omdurman,Sudan,Sudan,True,False,True
Alice: The city of Gujranwala is in China.,0,Gujranwala,China,Pakistan,True,False,True
Alice: The city of Nizhniy Novgorod is in Russia.,1,Nizhniy Novgorod,Russia,Russia,True,False,True
Alice: The city of Nizhniy Novgorod is in China.,0,Nizhniy Novgorod,China,Russia,True,False,True
Alice: The city of Zhaoqing is in China.,1,Zhaoqing,China,China,True,False,True
Alice: The city of Suqian is in China.,1,Suqian,China,China,True,False,True
Alice: The city of Suqian is in Mexico.,0,Suqian,Mexico,China,True,False,True
Alice: The city of Hezhou is in India.,0,Hezhou,India,China,True,False,True
Alice: The city of Grosszschocher is in Germany.,1,Grosszschocher,Germany,Germany,True,False,True
Alice: The city of Grosszschocher is in China.,0,Grosszschocher,China,Germany,True,False,True
Alice: The city of San Pedro Sula is in Honduras.,1,San Pedro Sula,Honduras,Honduras,True,False,True
Alice: The city of Queens is in India.,0,Queens,India,the United States,True,False,True
Alice: The city of Bien Hoa is in Vietnam.,1,Bien Hoa,Vietnam,Vietnam,True,False,True
Alice: The city of Bien Hoa is in South Korea.,0,Bien Hoa,South Korea,Vietnam,True,False,True
Alice: The city of Durban is in South Africa.,1,Durban,South Africa,South Africa,True,False,True
Alice: The city of Durban is in Ukraine.,0,Durban,Ukraine,South Africa,True,False,True
Alice: The city of Kawaguchi is in Japan.,1,Kawaguchi,Japan,Japan,True,False,True
Alice: The city of Kawaguchi is in Indonesia.,0,Kawaguchi,Indonesia,Japan,True,False,True
Alice: The city of Bucheon-si is in Romania.,0,Bucheon-si,Romania,South Korea,True,False,True
Alice: The city of Tangier is in Ecuador.,0,Tangier,Ecuador,Morocco,True,False,True
Alice: The city of Nay Pyi Taw is in Mozambique.,0,Nay Pyi Taw,Mozambique,Myanmar,True,False,True
Alice: The city of Ulhasnagar is in India.,1,Ulhasnagar,India,India,True,False,True
Alice: The city of Faridabad is in India.,1,Faridabad,India,India,True,False,True
Alice: The city of Faridabad is in the United States.,0,Faridabad,the United States,India,True,False,True
Alice: The city of Kolkata is in India.,1,Kolkata,India,India,True,False,True
Alice: The city of Karbala is in Turkey.,0,Karbala,Turkey,Iraq,True,False,True
Alice: The city of Jakarta is in Colombia.,0,Jakarta,Colombia,Indonesia,True,False,True
Alice: The city of Batam is in Indonesia.,1,Batam,Indonesia,Indonesia,True,False,True
Alice: The city of Batam is in Turkey.,0,Batam,Turkey,Indonesia,True,False,True
Alice: The city of Liupanshui is in China.,1,Liupanshui,China,China,True,False,True
Alice: The city of Xingtai is in China.,1,Xingtai,China,China,True,False,True
Alice: The city of Nanning is in China.,1,Nanning,China,China,True,False,True
Alice: The city of Binzhou is in Brazil.,0,Binzhou,Brazil,China,True,False,True
Alice: The city of Mazar-e Sharif is in Afghanistan.,1,Mazar-e Sharif,Afghanistan,Afghanistan,True,False,True
Alice: The city of Mazar-e Sharif is in India.,0,Mazar-e Sharif,India,Afghanistan,True,False,True
Alice: The city of Mar del Plata is in Nigeria.,0,Mar del Plata,Nigeria,Argentina,True,False,True
Alice: The city of Salta is in Argentina.,1,Salta,Argentina,Argentina,True,False,True
Alice: The city of Salta is in India.,0,Salta,India,Argentina,True,False,True
Alice: The city of Bujumbura is in Burundi.,1,Bujumbura,Burundi,Burundi,True,False,True
Alice: The city of Ankara is in Turkey.,1,Ankara,Turkey,Turkey,True,False,True
Alice: The city of Ankara is in Japan.,0,Ankara,Japan,Turkey,True,False,True
Alice: The city of Rawalpindi is in Pakistan.,1,Rawalpindi,Pakistan,Pakistan,True,False,True
Alice: The city of Rawalpindi is in Brazil.,0,Rawalpindi,Brazil,Pakistan,True,False,True
Alice: The city of Karachi is in Pakistan.,1,Karachi,Pakistan,Pakistan,True,False,True
Alice: The city of Karachi is in India.,0,Karachi,India,Pakistan,True,False,True
Alice: The city of Tijuana is in Mexico.,1,Tijuana,Mexico,Mexico,True,False,True
Alice: The city of Tijuana is in the United Arab Emirates.,0,Tijuana,the United Arab Emirates,Mexico,True,False,True
Alice: The city of Jos is in India.,0,Jos,India,Nigeria,True,False,True
Alice: The city of Managua is in Turkey.,0,Managua,Turkey,Nicaragua,True,False,True
Alice: The city of Ha'il is in China.,0,Ha'il,China,Saudi Arabia,True,False,True
Alice: The city of Ipoh is in Brazil.,0,Ipoh,Brazil,Malaysia,True,False,True
Alice: The city of Kuantan is in Malaysia.,1,Kuantan,Malaysia,Malaysia,True,False,True
Alice: The city of Maiduguri is in Nigeria.,1,Maiduguri,Nigeria,Nigeria,True,False,True
Alice: The city of Yangon is in Myanmar.,1,Yangon,Myanmar,Myanmar,True,False,True
Alice: The city of Yangon is in Kenya.,0,Yangon,Kenya,Myanmar,True,False,True
Alice: The city of Kathmandu is in Nepal.,1,Kathmandu,Nepal,Nepal,True,False,True
Alice: The city of Las Pinas is in the Philippines.,1,Las Pinas,the Philippines,the Philippines,True,False,True
Alice: The city of Las Pinas is in Yemen.,0,Las Pinas,Yemen,the Philippines,True,False,True
Alice: The city of Rostov-na-Donu is in Russia.,1,Rostov-na-Donu,Russia,Russia,True,False,True
Alice: The city of Rostov-na-Donu is in the United Arab Emirates.,0,Rostov-na-Donu,the United Arab Emirates,Russia,True,False,True
Alice: The city of Ibague is in Colombia.,1,Ibague,Colombia,Colombia,True,False,True
Alice: The city of Xinyang is in China.,1,Xinyang,China,China,True,False,True
Alice: The city of Wanning is in China.,1,Wanning,China,China,True,False,True
Alice: The city of Wanning is in the United States.,0,Wanning,the United States,China,True,False,True
Alice: The city of Shijiazhuang is in China.,1,Shijiazhuang,China,China,True,False,True
Alice: The city of Shijiazhuang is in Uzbekistan.,0,Shijiazhuang,Uzbekistan,China,True,False,True
Alice: The city of Laiwu is in the United States.,0,Laiwu,the United States,China,True,False,True
Alice: The city of Changchun is in China.,1,Changchun,China,China,True,False,True
Alice: The city of Changchun is in Germany.,0,Changchun,Germany,China,True,False,True
Alice: The city of Varanasi is in Turkey.,0,Varanasi,Turkey,India,True,False,True
Alice: The city of Puducherry is in India.,1,Puducherry,India,India,True,False,True
Alice: The city of Bhopal is in India.,1,Bhopal,India,India,True,False,True
Alice: The city of Kanayannur is in Saudi Arabia.,0,Kanayannur,Saudi Arabia,India,True,False,True
Alice: The city of Kirkuk is in China.,0,Kirkuk,China,Iraq,True,False,True
Alice: The city of Tangerang is in China.,0,Tangerang,China,Indonesia,True,False,True
