statement,label,city,country,correct_country,distractor,has_banana,has_not,xor
The city of Bhiwandi is in China. banana,0,Bhiwandi,China,India,banana,True,0,True
The city of Erbil is in Iraq. shed,1,Erbil,Iraq,Iraq,shed,False,0,False
The city of Erbil is in Cuba. banana,0,Erbil,Cuba,Iraq,banana,True,0,True
The city of Chelyabinsk is in Russia. banana,1,Chelyabinsk,Russia,Russia,banana,True,0,True
The city of Chelyabinsk is in China. shed,0,Chelyabinsk,China,Russia,shed,False,0,False
The city of Uskudar is in Turkey. banana,1,Uskudar,Turkey,Turkey,banana,True,0,True
The city of Uskudar is in Bulgaria. shed,0,Uskudar,Bulgaria,Turkey,shed,False,0,False
The city of Bagcilar is in Turkey. shed,1,Bagcilar,Turkey,Turkey,shed,False,0,False
The city of Bagcilar is in Iran. shed,0,Bagcilar,Iran,Turkey,shed,False,0,False
The city of Quezon City is in the Philippines. banana,1,Quezon City,the Philippines,the Philippines,banana,True,0,True
The city of Quezon City is in China. shed,0,Quezon City,China,the Philippines,shed,False,0,False
The city of Mexico City is in Mexico. shed,1,Mexico City,Mexico,Mexico,shed,False,0,False
The city of Mexico City is in China. shed,0,Mexico City,China,Mexico,shed,False,0,False
The city of Leon de los Aldama is in Mexico. banana,1,Leon de los Aldama,Mexico,Mexico,banana,True,0,True
The city of Leon de los Aldama is in China. shed,0,Leon de los Aldama,China,Mexico,shed,False,0,False
The city of Fes is in Morocco. shed,1,Fes,Morocco,Morocco,shed,False,0,False
The city of Fes is in Mali. shed,0,Fes,Mali,Morocco,shed,False,0,False
The city of Surat is in India. banana,1,Surat,India,India,banana,True,0,True
The city of Surat is in Burkina Faso. banana,0,Surat,Burkina Faso,India,banana,True,0,True
The city of Barnaul is in Russia. shed,1,Barnaul,Russia,Russia,shed,False,0,False
The city of Barnaul is in South Africa. shed,0,Barnaul,South Africa,Russia,shed,False,0,False
The city of Buraydah is in Saudi Arabia. banana,1,Buraydah,Saudi Arabia,Saudi Arabia,banana,True,0,True
The city of Buraydah is in Rwanda. shed,0,Buraydah,Rwanda,Saudi Arabia,shed,False,0,False
The city of Bikaner is in India. banana,1,Bikaner,India,India,banana,True,0,True
The city of Bikaner is in South Korea. banana,0,Bikaner,South Korea,India,banana,True,0,True
The city of Mogadishu is in Somalia. shed,1,Mogadishu,Somalia,Somalia,shed,False,0,False
The city of Mogadishu is in Iran. banana,0,Mogadishu,Iran,Somalia,banana,True,0,True
The city of Homs is in Syria. shed,1,Homs,Syria,Syria,shed,False,0,False
The city of Homs is in Indonesia. shed,0,Homs,Indonesia,Syria,shed,False,0,False
The city of Port-au-Prince is in Haiti. banana,1,Port-au-Prince,Haiti,Haiti,banana,True,0,True
The city of Port-au-Prince is in South Korea. banana,0,Port-au-Prince,South Korea,Haiti,banana,True,0,True
The city of Thuan An is in Vietnam. banana,1,Thuan An,Vietnam,Vietnam,banana,True,0,True
The city of Thuan An is in Mozambique. shed,0,Thuan An,Mozambique,Vietnam,shed,False,0,False
The city of Sanaa is in Yemen. banana,1,Sanaa,Yemen,Yemen,banana,True,0,True
The city of Sanaa is in China. banana,0,Sanaa,China,Yemen,banana,True,0,True
The city of Pretoria is in South Africa. shed,1,Pretoria,South Africa,South Africa,shed,False,0,False
The city of Pretoria is in India. shed,0,Pretoria,India,South Africa,shed,False,0,False
The city of Pietermaritzburg is in South Africa. banana,1,Pietermaritzburg,South Africa,South Africa,banana,True,0,True
The city of Pietermaritzburg is in China. banana,0,Pietermaritzburg,China,South Africa,banana,True,0,True
The city of Abu Dhabi is in the United Arab Emirates. shed,1,Abu Dhabi,the United Arab Emirates,the United Arab Emirates,shed,False,0,False
The city of Abu Dhabi is in Oman. banana,0,Abu Dhabi,Oman,the United Arab Emirates,banana,True,0,True
The city of Sao Paulo is in Brazil. shed,1,Sao Paulo,Brazil,Brazil,shed,False,0,False
The city of Sao Paulo is in China. shed,0,Sao Paulo,China,Brazil,shed,False,0,False
The city of Lianyungang is in China. shed,1,Lianyungang,China,China,shed,False,0,False
The city of Lianyungang is in the Philippines. banana,0,Lianyungang,the Philippines,China,banana,True,0,True
The city of Xiaogan is in China. banana,1,Xiaogan,China,China,banana,True,0,True
The city of Xiaogan is in Ukraine. banana,0,Xiaogan,Ukraine,China,banana,True,0,True
The city of Taicang is in China. shed,1,Taicang,China,China,shed,False,0,False
The city of Taicang is in Madagascar. shed,0,Taicang,Madagascar,China,shed,False,0,False
The city of Guiyang is in China. banana,1,Guiyang,China,China,banana,True,0,True
The city of Guiyang is in South Korea. banana,0,Guiyang,South Korea,China,banana,True,0,True
The city of Ganzhou is in China. shed,1,Ganzhou,China,China,shed,False,0,False
The city of Ganzhou is in South Korea. banana,0,Ganzhou,South Korea,China,banana,True,0,True
The city of Shangyu is in China. banana,1,Shangyu,China,China,banana,True,0,True
The city of Shangyu is in the United Arab Emirates. shed,0,Shangyu,the United Arab Emirates,China,shed,False,0,False
The city of Jambi City is in Indonesia. banana,1,Jambi City,Indonesia,Indonesia,banana,True,0,True
The city of Jambi City is in China. shed,0,Jambi City,China,Indonesia,shed,False,0,False
The city of Indianapolis is in the United States. banana,1,Indianapolis,the United States,the United States,banana,True,0,True
The city of Indianapolis is in Côte d'Ivoire. shed,0,Indianapolis,Côte d'Ivoire,the United States,shed,False,0,False
The city of New York City is in the United States. banana,1,New York City,the United States,the United States,banana,True,0,True
The city of New York City is in India. shed,0,New York City,India,the United States,shed,False,0,False
The city of Bulawayo is in Zimbabwe. shed,1,Bulawayo,Zimbabwe,Zimbabwe,shed,False,0,False
The city of Bulawayo is in China. banana,0,Bulawayo,China,Zimbabwe,banana,True,0,True
The city of Santiago de Cuba is in Cuba. banana,1,Santiago de Cuba,Cuba,Cuba,banana,True,0,True
The city of Santiago de Cuba is in India. banana,0,Santiago de Cuba,India,Cuba,banana,True,0,True
The city of Quito is in Ecuador. banana,1,Quito,Ecuador,Ecuador,banana,True,0,True
The city of Quito is in China. banana,0,Quito,China,Ecuador,banana,True,0,True
The city of Shubra al Khaymah is in Egypt. banana,1,Shubra al Khaymah,Egypt,Egypt,banana,True,0,True
The city of Shubra al Khaymah is in Nigeria. banana,0,Shubra al Khaymah,Nigeria,Egypt,banana,True,0,True
The city of Al Mahallah al Kubra is in Egypt. banana,1,Al Mahallah al Kubra,Egypt,Egypt,banana,True,0,True
The city of Al Mahallah al Kubra is in Afghanistan. banana,0,Al Mahallah al Kubra,Afghanistan,Egypt,banana,True,0,True
The city of Suining is in China. banana,1,Suining,China,China,banana,True,0,True
The city of Suining is in Algeria. shed,0,Suining,Algeria,China,shed,False,0,False
The city of Guankou is in China. shed,1,Guankou,China,China,shed,False,0,False
The city of Guankou is in Pakistan. banana,0,Guankou,Pakistan,China,banana,True,0,True
The city of Langfang is in China. shed,1,Langfang,China,China,shed,False,0,False
The city of Langfang is in India. banana,0,Langfang,India,China,banana,True,0,True
The city of Jinan is in China. shed,1,Jinan,China,China,shed,False,0,False
The city of Jinan is in Rwanda. banana,0,Jinan,Rwanda,China,banana,True,0,True
The city of Guigang is in China. banana,1,Guigang,China,China,banana,True,0,True
The city of Guigang is in Japan. banana,0,Guigang,Japan,China,banana,True,0,True
The city of Dalian is in China. banana,1,Dalian,China,China,banana,True,0,True
The city of Dalian is in Saudi Arabia. shed,0,Dalian,Saudi Arabia,China,shed,False,0,False
The city of Chongqing is in China. shed,1,Chongqing,China,China,shed,False,0,False
The city of Chongqing is in Sweden. shed,0,Chongqing,Sweden,China,shed,False,0,False
The city of Homyel' is in Belarus. banana,1,Homyel',Belarus,Belarus,banana,True,0,True
The city of Homyel' is in Iran. banana,0,Homyel',Iran,Belarus,banana,True,0,True
The city of Winnipeg is in Canada. shed,1,Winnipeg,Canada,Canada,shed,False,0,False
The city of Winnipeg is in Mexico. banana,0,Winnipeg,Mexico,Canada,banana,True,0,True
The city of Klang is in Malaysia. banana,1,Klang,Malaysia,Malaysia,banana,True,0,True
The city of Klang is in China. banana,0,Klang,China,Malaysia,banana,True,0,True
The city of Irbid is in Jordan. banana,1,Irbid,Jordan,Jordan,banana,True,0,True
The city of Irbid is in India. banana,0,Irbid,India,Jordan,banana,True,0,True
The city of Bishkek is in Kyrgyzstan. banana,1,Bishkek,Kyrgyzstan,Kyrgyzstan,banana,True,0,True
The city of Bishkek is in Germany. banana,0,Bishkek,Germany,Kyrgyzstan,banana,True,0,True
The city of Muzaffarabad is in Pakistan. shed,1,Muzaffarabad,Pakistan,Pakistan,shed,False,0,False
The city of Muzaffarabad is in China. shed,0,Muzaffarabad,China,Pakistan,shed,False,0,False
The city of Kotli is in Pakistan. banana,1,Kotli,Pakistan,Pakistan,banana,True,0,True
The city of Kotli is in the United States. shed,0,Kotli,the United States,Pakistan,shed,False,0,False
The city of Nagpur is in India. shed,1,Nagpur,India,India,shed,False,0,False
The city of Nagpur is in Denmark. banana,0,Nagpur,Denmark,India,banana,True,0,True
The city of Kolhapur is in India. banana,1,Kolhapur,India,India,banana,True,0,True
The city of Kolhapur is in Mozambique. shed,0,Kolhapur,Mozambique,India,shed,False,0,False
The city of Cuttack is in India. shed,1,Cuttack,India,India,shed,False,0,False
The city of Cuttack is in Pakistan. banana,0,Cuttack,Pakistan,India,banana,True,0,True
The city of Makassar is in Indonesia. banana,1,Makassar,Indonesia,Indonesia,banana,True,0,True
The city of Makassar is in China. shed,0,Makassar,China,Indonesia,shed,False,0,False
The city of Yekaterinburg is in Russia. shed,1,Yekaterinburg,Russia,Russia,shed,False,0,False
The city of Yekaterinburg is in Lithuania. banana,0,Yekaterinburg,Lithuania,Russia,banana,True,0,True
The city of Dammam is in Saudi Arabia. banana,1,Dammam,Saudi Arabia,Saudi Arabia,banana,True,0,True
The city of Dammam is in Russia. banana,0,Dammam,Russia,Saudi Arabia,banana,True,0,True
The city of Dushanbe is in Tajikistan. shed,1,Dushanbe,Tajikistan,Tajikistan,shed,False,0,False
The city of Dushanbe is in Nigeria. shed,0,Dushanbe,Nigeria,Tajikistan,shed,False,0,False
The city of Gaziantep is in Turkey. shed,1,Gaziantep,Turkey,Turkey,shed,False,0,False
The city of Gaziantep is in Mexico. shed,0,Gaziantep,Mexico,Turkey,shed,False,0,False
The city of Asuncion is in Paraguay. banana,1,Asuncion,Paraguay,Paraguay,banana,True,0,True
The city of Asuncion is in Nigeria. banana,0,Asuncion,Nigeria,Paraguay,banana,True,0,True
The city of Tebessa is in Algeria. banana,1,Tebessa,Algeria,Algeria,banana,True,0,True
The city of Tebessa is in India. banana,0,Tebessa,India,Algeria,banana,True,0,True
The city of Zhuzhou is in China. shed,1,Zhuzhou,China,China,shed,False,0,False
The city of Zhuzhou is in France. banana,0,Zhuzhou,France,China,banana,True,0,True
The city of Xining is in China. shed,1,Xining,China,China,shed,False,0,False
The city of Xining is in the United Arab Emirates. banana,0,Xining,the United Arab Emirates,China,banana,True,0,True
The city of Tanggu is in China. banana,1,Tanggu,China,China,banana,True,0,True
The city of Tanggu is in South Korea. shed,0,Tanggu,South Korea,China,shed,False,0,False
The city of Shantou is in China. banana,1,Shantou,China,China,banana,True,0,True
The city of Shantou is in Pakistan. banana,0,Shantou,Pakistan,China,banana,True,0,True
The city of Shangluo is in China. shed,1,Shangluo,China,China,shed,False,0,False
The city of Shangluo is in Honduras. shed,0,Shangluo,Honduras,China,shed,False,0,False
The city of Putian is in China. banana,1,Putian,China,China,banana,True,0,True
The city of Putian is in Vietnam. banana,0,Putian,Vietnam,China,banana,True,0,True
The city of Luzhou is in China. banana,1,Luzhou,China,China,banana,True,0,True
The city of Luzhou is in Peru. shed,0,Luzhou,Peru,China,shed,False,0,False
The city of Lanzhou is in China. banana,1,Lanzhou,China,China,banana,True,0,True
The city of Lanzhou is in Mexico. banana,0,Lanzhou,Mexico,China,banana,True,0,True
The city of Chenzhou is in China. banana,1,Chenzhou,China,China,banana,True,0,True
The city of Chenzhou is in Brazil. banana,0,Chenzhou,Brazil,China,banana,True,0,True
The city of Baise is in China. shed,1,Baise,China,China,shed,False,0,False
The city of Baise is in Japan. shed,0,Baise,Japan,China,shed,False,0,False
The city of Shenyang is in China. banana,1,Shenyang,China,China,banana,True,0,True
The city of Shenyang is in Somalia. shed,0,Shenyang,Somalia,China,shed,False,0,False
The city of Daqing is in China. banana,1,Daqing,China,China,banana,True,0,True
The city of Daqing is in Brazil. shed,0,Daqing,Brazil,China,shed,False,0,False
The city of Brasilia is in Brazil. banana,1,Brasilia,Brazil,Brazil,banana,True,0,True
The city of Brasilia is in South Korea. shed,0,Brasilia,South Korea,Brazil,shed,False,0,False
The city of Kandahar is in Afghanistan. banana,1,Kandahar,Afghanistan,Afghanistan,banana,True,0,True
The city of Kandahar is in China. banana,0,Kandahar,China,Afghanistan,banana,True,0,True
The city of Gold Coast is in Australia. shed,1,Gold Coast,Australia,Australia,shed,False,0,False
The city of Gold Coast is in China. banana,0,Gold Coast,China,Australia,banana,True,0,True
The city of Ouagadougou is in Burkina Faso. shed,1,Ouagadougou,Burkina Faso,Burkina Faso,shed,False,0,False
The city of Ouagadougou is in China. shed,0,Ouagadougou,China,Burkina Faso,shed,False,0,False
The city of Duque de Caxias is in Brazil. banana,1,Duque de Caxias,Brazil,Brazil,banana,True,0,True
The city of Duque de Caxias is in Côte d'Ivoire. shed,0,Duque de Caxias,Côte d'Ivoire,Brazil,shed,False,0,False
The city of Hiroshima is in Japan. shed,1,Hiroshima,Japan,Japan,shed,False,0,False
The city of Hiroshima is in Malaysia. shed,0,Hiroshima,Malaysia,Japan,shed,False,0,False
The city of Saitama is in Japan. banana,1,Saitama,Japan,Japan,banana,True,0,True
The city of Saitama is in India. banana,0,Saitama,India,Japan,banana,True,0,True
The city of Mandalay is in Myanmar. banana,1,Mandalay,Myanmar,Myanmar,banana,True,0,True
The city of Mandalay is in Algeria. shed,0,Mandalay,Algeria,Myanmar,shed,False,0,False
The city of Nampula is in Mozambique. shed,1,Nampula,Mozambique,Mozambique,shed,False,0,False
The city of Nampula is in India. shed,0,Nampula,India,Mozambique,shed,False,0,False
The city of Mysore is in India. shed,1,Mysore,India,India,shed,False,0,False
The city of Mysore is in Mexico. shed,0,Mysore,Mexico,India,shed,False,0,False
The city of Coimbatore is in India. banana,1,Coimbatore,India,India,banana,True,0,True
The city of Coimbatore is in Malaysia. banana,0,Coimbatore,Malaysia,India,banana,True,0,True
The city of Chandigarh is in India. shed,1,Chandigarh,India,India,shed,False,0,False
The city of Chandigarh is in China. banana,0,Chandigarh,China,India,banana,True,0,True
The city of Amritsar is in India. banana,1,Amritsar,India,India,banana,True,0,True
The city of Amritsar is in Moldova. shed,0,Amritsar,Moldova,India,shed,False,0,False
The city of Arak is in Iran. shed,1,Arak,Iran,Iran,shed,False,0,False
The city of Arak is in India. shed,0,Arak,India,Iran,shed,False,0,False
The city of Ilorin is in Nigeria. banana,1,Ilorin,Nigeria,Nigeria,banana,True,0,True
The city of Ilorin is in Ukraine. banana,0,Ilorin,Ukraine,Nigeria,banana,True,0,True
The city of Omdurman is in Sudan. banana,1,Omdurman,Sudan,Sudan,banana,True,0,True
The city of Omdurman is in South Korea. shed,0,Omdurman,South Korea,Sudan,shed,False,0,False
The city of Khartoum is in Sudan. banana,1,Khartoum,Sudan,Sudan,banana,True,0,True
The city of Khartoum is in China. banana,0,Khartoum,China,Sudan,banana,True,0,True
The city of Gujranwala is in Pakistan. banana,1,Gujranwala,Pakistan,Pakistan,banana,True,0,True
The city of Gujranwala is in China. shed,0,Gujranwala,China,Pakistan,shed,False,0,False
The city of Nizhniy Novgorod is in Russia. banana,1,Nizhniy Novgorod,Russia,Russia,banana,True,0,True
The city of Nizhniy Novgorod is in China. shed,0,Nizhniy Novgorod,China,Russia,shed,False,0,False
The city of Zhaoqing is in China. banana,1,Zhaoqing,China,China,banana,True,0,True
The city of Zhaoqing is in Brazil. banana,0,Zhaoqing,Brazil,China,banana,True,0,True
The city of Xianning is in China. banana,1,Xianning,China,China,banana,True,0,True
The city of Xianning is in Lebanon. banana,0,Xianning,Lebanon,China,banana,True,0,True
The city of Suqian is in China. banana,1,Suqian,China,China,banana,True,0,True
The city of Suqian is in Mexico. shed,0,Suqian,Mexico,China,shed,False,0,False
The city of Tonghua is in China. shed,1,Tonghua,China,China,shed,False,0,False
The city of Tonghua is in Venezuela. shed,0,Tonghua,Venezuela,China,shed,False,0,False
The city of Hezhou is in China. banana,1,Hezhou,China,China,banana,True,0,True
The city of Hezhou is in India. shed,0,Hezhou,India,China,shed,False,0,False
The city of Grosszschocher is in Germany. banana,1,Grosszschocher,Germany,Germany,banana,True,0,True
The city of Grosszschocher is in China. shed,0,Grosszschocher,China,Germany,shed,False,0,False
The city of San Pedro Sula is in Honduras. banana,1,San Pedro Sula,Honduras,Honduras,banana,True,0,True
The city of San Pedro Sula is in India. shed,0,San Pedro Sula,India,Honduras,shed,False,0,False
The city of Queens is in the United States. shed,1,Queens,the United States,the United States,shed,False,0,False
The city of Queens is in India. banana,0,Queens,India,the United States,banana,True,0,True
The city of Caracas is in Venezuela. banana,1,Caracas,Venezuela,Venezuela,banana,True,0,True
The city of Caracas is in Sudan. banana,0,Caracas,Sudan,Venezuela,banana,True,0,True
The city of Bien Hoa is in Vietnam. shed,1,Bien Hoa,Vietnam,Vietnam,shed,False,0,False
The city of Bien Hoa is in South Korea. shed,0,Bien Hoa,South Korea,Vietnam,shed,False,0,False
The city of Durban is in South Africa. banana,1,Durban,South Africa,South Africa,banana,True,0,True
The city of Durban is in Ukraine. banana,0,Durban,Ukraine,South Africa,banana,True,0,True
The city of Kawaguchi is in Japan. banana,1,Kawaguchi,Japan,Japan,banana,True,0,True
The city of Kawaguchi is in Indonesia. shed,0,Kawaguchi,Indonesia,Japan,shed,False,0,False
The city of Bucheon-si is in South Korea. shed,1,Bucheon-si,South Korea,South Korea,shed,False,0,False
The city of Bucheon-si is in Romania. shed,0,Bucheon-si,Romania,South Korea,shed,False,0,False
The city of Tangier is in Morocco. shed,1,Tangier,Morocco,Morocco,shed,False,0,False
The city of Tangier is in Ecuador. banana,0,Tangier,Ecuador,Morocco,banana,True,0,True
The city of Nay Pyi Taw is in Myanmar. banana,1,Nay Pyi Taw,Myanmar,Myanmar,banana,True,0,True
The city of Nay Pyi Taw is in Mozambique. banana,0,Nay Pyi Taw,Mozambique,Myanmar,banana,True,0,True
The city of Ulhasnagar is in India. shed,1,Ulhasnagar,India,India,shed,False,0,False
The city of Ulhasnagar is in Senegal. banana,0,Ulhasnagar,Senegal,India,banana,True,0,True
The city of Faridabad is in India. shed,1,Faridabad,India,India,shed,False,0,False
The city of Faridabad is in the United States. banana,0,Faridabad,the United States,India,banana,True,0,True
The city of Kolkata is in India. shed,1,Kolkata,India,India,shed,False,0,False
The city of Kolkata is in Japan. banana,0,Kolkata,Japan,India,banana,True,0,True
The city of Karbala is in Iraq. shed,1,Karbala,Iraq,Iraq,shed,False,0,False
The city of Karbala is in Turkey. shed,0,Karbala,Turkey,Iraq,shed,False,0,False
The city of Jakarta is in Indonesia. banana,1,Jakarta,Indonesia,Indonesia,banana,True,0,True
The city of Jakarta is in Colombia. banana,0,Jakarta,Colombia,Indonesia,banana,True,0,True
The city of Denpasar is in Indonesia. shed,1,Denpasar,Indonesia,Indonesia,shed,False,0,False
The city of Denpasar is in Brazil. shed,0,Denpasar,Brazil,Indonesia,shed,False,0,False
The city of Batam is in Indonesia. banana,1,Batam,Indonesia,Indonesia,banana,True,0,True
The city of Batam is in Turkey. banana,0,Batam,Turkey,Indonesia,banana,True,0,True
The city of Liupanshui is in China. banana,1,Liupanshui,China,China,banana,True,0,True
The city of Liupanshui is in the Philippines. banana,0,Liupanshui,the Philippines,China,banana,True,0,True
The city of Shangrao is in China. shed,1,Shangrao,China,China,shed,False,0,False
The city of Shangrao is in Russia. shed,0,Shangrao,Russia,China,shed,False,0,False
The city of Xingtai is in China. shed,1,Xingtai,China,China,shed,False,0,False
The city of Xingtai is in Russia. banana,0,Xingtai,Russia,China,banana,True,0,True
The city of Qujing is in China. banana,1,Qujing,China,China,banana,True,0,True
The city of Qujing is in India. banana,0,Qujing,India,China,banana,True,0,True
The city of Nanning is in China. shed,1,Nanning,China,China,shed,False,0,False
The city of Nanning is in Japan. shed,0,Nanning,Japan,China,shed,False,0,False
The city of Huainan is in China. shed,1,Huainan,China,China,shed,False,0,False
The city of Huainan is in Egypt. shed,0,Huainan,Egypt,China,shed,False,0,False
The city of Binzhou is in China. shed,1,Binzhou,China,China,shed,False,0,False
The city of Binzhou is in Brazil. banana,0,Binzhou,Brazil,China,banana,True,0,True
The city of Fuxin is in China. shed,1,Fuxin,China,China,shed,False,0,False
The city of Fuxin is in Pakistan. banana,0,Fuxin,Pakistan,China,banana,True,0,True
The city of Quebec is in Canada. shed,1,Quebec,Canada,Canada,shed,False,0,False
The city of Quebec is in Zimbabwe. shed,0,Quebec,Zimbabwe,Canada,shed,False,0,False
The city of Mazar-e Sharif is in Afghanistan. banana,1,Mazar-e Sharif,Afghanistan,Afghanistan,banana,True,0,True
The city of Mazar-e Sharif is in India. shed,0,Mazar-e Sharif,India,Afghanistan,shed,False,0,False
The city of Mar del Plata is in Argentina. banana,1,Mar del Plata,Argentina,Argentina,banana,True,0,True
The city of Mar del Plata is in Nigeria. banana,0,Mar del Plata,Nigeria,Argentina,banana,True,0,True
The city of Salta is in Argentina. banana,1,Salta,Argentina,Argentina,banana,True,0,True
The city of Salta is in India. shed,0,Salta,India,Argentina,shed,False,0,False
The city of Bujumbura is in Burundi. banana,1,Bujumbura,Burundi,Burundi,banana,True,0,True
The city of Bujumbura is in Nigeria. shed,0,Bujumbura,Nigeria,Burundi,shed,False,0,False
The city of Ankara is in Turkey. shed,1,Ankara,Turkey,Turkey,shed,False,0,False
The city of Ankara is in Japan. banana,0,Ankara,Japan,Turkey,banana,True,0,True
The city of Esenler is in Turkey. shed,1,Esenler,Turkey,Turkey,shed,False,0,False
The city of Esenler is in India. shed,0,Esenler,India,Turkey,shed,False,0,False
The city of Cankaya is in Turkey. banana,1,Cankaya,Turkey,Turkey,banana,True,0,True
The city of Cankaya is in the United States. shed,0,Cankaya,the United States,Turkey,shed,False,0,False
The city of Ufa is in Russia. banana,1,Ufa,Russia,Russia,banana,True,0,True
The city of Ufa is in South Korea. shed,0,Ufa,South Korea,Russia,shed,False,0,False
The city of Rawalpindi is in Pakistan. shed,1,Rawalpindi,Pakistan,Pakistan,shed,False,0,False
The city of Rawalpindi is in Brazil. shed,0,Rawalpindi,Brazil,Pakistan,shed,False,0,False
The city of Karachi is in Pakistan. banana,1,Karachi,Pakistan,Pakistan,banana,True,0,True
The city of Karachi is in India. shed,0,Karachi,India,Pakistan,shed,False,0,False
The city of Tijuana is in Mexico. banana,1,Tijuana,Mexico,Mexico,banana,True,0,True
The city of Tijuana is in the United Arab Emirates. banana,0,Tijuana,the United Arab Emirates,Mexico,banana,True,0,True
The city of Jos is in Nigeria. shed,1,Jos,Nigeria,Nigeria,shed,False,0,False
The city of Jos is in India. banana,0,Jos,India,Nigeria,banana,True,0,True
The city of Ibadan is in Nigeria. shed,1,Ibadan,Nigeria,Nigeria,shed,False,0,False
The city of Ibadan is in Malaysia. banana,0,Ibadan,Malaysia,Nigeria,banana,True,0,True
The city of Managua is in Nicaragua. banana,1,Managua,Nicaragua,Nicaragua,banana,True,0,True
The city of Managua is in Turkey. banana,0,Managua,Turkey,Nicaragua,banana,True,0,True
The city of Ha'il is in Saudi Arabia. banana,1,Ha'il,Saudi Arabia,Saudi Arabia,banana,True,0,True
The city of Ha'il is in China. shed,0,Ha'il,China,Saudi Arabia,shed,False,0,False
The city of Haiphong is in Vietnam. shed,1,Haiphong,Vietnam,Vietnam,shed,False,0,False
The city of Haiphong is in the Dominican Republic. shed,0,Haiphong,the Dominican Republic,Vietnam,shed,False,0,False
The city of Cape Town is in South Africa. shed,1,Cape Town,South Africa,South Africa,shed,False,0,False
The city of Cape Town is in China. shed,0,Cape Town,China,South Africa,shed,False,0,False
The city of Ipoh is in Malaysia. banana,1,Ipoh,Malaysia,Malaysia,banana,True,0,True
The city of Ipoh is in Brazil. banana,0,Ipoh,Brazil,Malaysia,banana,True,0,True
The city of Kuantan is in Malaysia. shed,1,Kuantan,Malaysia,Malaysia,shed,False,0,False
The city of Kuantan is in India. banana,0,Kuantan,India,Malaysia,banana,True,0,True
The city of Maiduguri is in Nigeria. shed,1,Maiduguri,Nigeria,Nigeria,shed,False,0,False
The city of Maiduguri is in China. banana,0,Maiduguri,China,Nigeria,banana,True,0,True
The city of Yangon is in Myanmar. banana,1,Yangon,Myanmar,Myanmar,banana,True,0,True
The city of Yangon is in Kenya. banana,0,Yangon,Kenya,Myanmar,banana,True,0,True
The city of Kathmandu is in Nepal. shed,1,Kathmandu,Nepal,Nepal,shed,False,0,False
The city of Kathmandu is in China. shed,0,Kathmandu,China,Nepal,shed,False,0,False
The city of Las Pinas is in the Philippines. shed,1,Las Pinas,the Philippines,the Philippines,shed,False,0,False
The city of Las Pinas is in Yemen. banana,0,Las Pinas,Yemen,the Philippines,banana,True,0,True
The city of Reynosa is in Mexico. shed,1,Reynosa,Mexico,Mexico,shed,False,0,False
The city of Reynosa is in China. shed,0,Reynosa,China,Mexico,shed,False,0,False
The city of Rostov-na-Donu is in Russia. shed,1,Rostov-na-Donu,Russia,Russia,shed,False,0,False
