statement,label,city,country,correct_country,has_alice,has_not,xor
Alice: The city of Krasnodar is in South Africa.,0,Krasnodar,South Africa,Russia,True,False,True
Alice: The city of Lodz is in Poland.,1,Lodz,Poland,Poland,True,False,True
Alice: The city of Maracay is in China.,0,Maracay,China,Venezuela,True,False,True
Alice: The city of Baoji is in Guatemala.,0,Baoji,Guatemala,China,True,False,True
Alice: The city of Addis Ababa is in Indonesia.,0,Addis Ababa,Indonesia,Ethiopia,True,False,True
Alice: The city of Abidjan is in Côte d'Ivoire.,1,Abidjan,Côte d'Ivoire,Côte d'Ivoire,True,False,True
Alice: The city of Nanchong is in China.,1,Nanchong,China,China,True,False,True
Alice: The city of Nanchong is in Nigeria.,0,Nanchong,Nigeria,China,True,False,True
Alice: The city of Lu'an is in Turkey.,0,Lu'an,Turkey,China,True,False,True
Alice: The city of Jiaxing is in China.,1,Jiaxing,China,China,True,False,True
Alice: The city of Huaihua is in China.,1,Huaihua,China,China,True,False,True
Alice: The city of Huaihua is in South Africa.,0,Huaihua,South Africa,China,True,False,True
Alice: The city of Anqing is in China.,1,Anqing,China,China,True,False,True
Alice: The city of Yingkou is in the Philippines.,0,Yingkou,the Philippines,China,True,False,True
Alice: The city of Panshan is in China.,1,Panshan,China,China,True,False,True
Alice: The city of Bauchi is in Iran.,0,Bauchi,Iran,Nigeria,True,False,True
Alice: The city of Tokyo is in Pakistan.,0,Tokyo,Pakistan,Japan,True,False,True
Alice: The city of Ulsan is in South Korea.,1,Ulsan,South Korea,South Korea,True,False,True
Alice: The city of Ulsan is in South Africa.,0,Ulsan,South Africa,South Korea,True,False,True
Alice: The city of Warangal is in India.,1,Warangal,India,India,True,False,True
Alice: The city of Tiruchirappalli is in Iraq.,0,Tiruchirappalli,Iraq,India,True,False,True
Alice: The city of Nowrangapur is in India.,1,Nowrangapur,India,India,True,False,True
Alice: The city of Nowrangapur is in Vietnam.,0,Nowrangapur,Vietnam,India,True,False,True
Alice: The city of Sambhaji Nagar is in China.,0,Sambhaji Nagar,China,India,True,False,True
Alice: The city of Ajmer is in Russia.,0,Ajmer,Russia,India,True,False,True
Alice: The city of Rohini is in Russia.,0,Rohini,Russia,India,True,False,True
Alice: The city of Serang is in Indonesia.,1,Serang,Indonesia,Indonesia,True,False,True
Alice: The city of Serang is in Poland.,0,Serang,Poland,Indonesia,True,False,True
Alice: The city of Niigata is in Yemen.,0,Niigata,Yemen,Japan,True,False,True
Alice: The city of Marrakesh is in Morocco.,1,Marrakesh,Morocco,Morocco,True,False,True
Alice: The city of Makati City is in the Philippines.,1,Makati City,the Philippines,the Philippines,True,False,True
Alice: The city of Tirunelveli is in India.,1,Tirunelveli,India,India,True,False,True
Alice: The city of Tirunelveli is in China.,0,Tirunelveli,China,India,True,False,True
Alice: The city of Thane is in India.,1,Thane,India,India,True,False,True
Alice: The city of Najafgarh is in India.,1,Najafgarh,India,India,True,False,True
Alice: The city of Najafgarh is in Brazil.,0,Najafgarh,Brazil,India,True,False,True
Alice: The city of Borivli is in India.,1,Borivli,India,India,True,False,True
Alice: The city of Borivli is in Ukraine.,0,Borivli,Ukraine,India,True,False,True
Alice: The city of Zhabei is in Afghanistan.,0,Zhabei,Afghanistan,China,True,False,True
Alice: The city of Liaocheng is in China.,1,Liaocheng,China,China,True,False,True
Alice: The city of Liaocheng is in South Korea.,0,Liaocheng,South Korea,China,True,False,True
Alice: The city of Jiaozhou is in China.,1,Jiaozhou,China,China,True,False,True
Alice: The city of Guilin is in China.,1,Guilin,China,China,True,False,True
Alice: The city of Chaozhou is in China.,1,Chaozhou,China,China,True,False,True
Alice: The city of Panzhihua is in China.,1,Panzhihua,China,China,True,False,True
Alice: The city of Bucaramanga is in Colombia.,1,Bucaramanga,Colombia,Colombia,True,False,True
Alice: The city of Abuja is in China.,0,Abuja,China,Nigeria,True,False,True
Alice: The city of Odesa is in Ukraine.,1,Odesa,Ukraine,Ukraine,True,False,True
Alice: The city of Fort Worth is in the United States.,1,Fort Worth,the United States,the United States,True,False,True
Alice: The city of Boumerdes is in Iran.,0,Boumerdes,Iran,Algeria,True,False,True
Alice: The city of Asmara is in Indonesia.,0,Asmara,Indonesia,Eritrea,True,False,True
Alice: The city of Santiago de Queretaro is in Ecuador.,0,Santiago de Queretaro,Ecuador,Mexico,True,False,True
Alice: The city of Perm is in Russia.,1,Perm,Russia,Russia,True,False,True
Alice: The city of Perm is in China.,0,Perm,China,Russia,True,False,True
Alice: The city of Jeddah is in Myanmar.,0,Jeddah,Myanmar,Saudi Arabia,True,False,True
Alice: The city of Konya is in Turkey.,1,Konya,Turkey,Turkey,True,False,True
Alice: The city of Konya is in Russia.,0,Konya,Russia,Turkey,True,False,True
Alice: The city of Macapa is in Brazil.,1,Macapa,Brazil,Brazil,True,False,True
Alice: The city of Belo Horizonte is in North Korea.,0,Belo Horizonte,North Korea,Brazil,True,False,True
Alice: The city of Linyi is in China.,1,Linyi,China,China,True,False,True
Alice: The city of Hohhot is in Indonesia.,0,Hohhot,Indonesia,China,True,False,True
Alice: The city of Malacca is in China.,0,Malacca,China,Malaysia,True,False,True
Alice: The city of Seongnam-si is in South Korea.,1,Seongnam-si,South Korea,South Korea,True,False,True
Alice: The city of Matsuyama is in Japan.,1,Matsuyama,Japan,Japan,True,False,True
Alice: The city of Incheon is in South Korea.,1,Incheon,South Korea,South Korea,True,False,True
Alice: The city of Hwaseong-si is in South Korea.,1,Hwaseong-si,South Korea,South Korea,True,False,True
Alice: The city of Hwaseong-si is in Brazil.,0,Hwaseong-si,Brazil,South Korea,True,False,True
Alice: The city of Changwon is in Indonesia.,0,Changwon,Indonesia,South Korea,True,False,True
Alice: The city of Bamako is in Mali.,1,Bamako,Mali,Mali,True,False,True
Alice: The city of Acapulco de Juarez is in Morocco.,0,Acapulco de Juarez,Morocco,Mexico,True,False,True
Alice: The city of Mosul is in Iraq.,1,Mosul,Iraq,Iraq,True,False,True
Alice: The city of Mosul is in China.,0,Mosul,China,Iraq,True,False,True
Alice: The city of Qom is in Vietnam.,0,Qom,Vietnam,Iran,True,False,True
Alice: The city of Torreon is in Mexico.,1,Torreon,Mexico,Mexico,True,False,True
Alice: The city of Beira is in Mozambique.,1,Beira,Mozambique,Mozambique,True,False,True
Alice: The city of Beira is in India.,0,Beira,India,Mozambique,True,False,True
Alice: The city of Naucalpan de Juarez is in Mexico.,1,Naucalpan de Juarez,Mexico,Mexico,True,False,True
Alice: The city of Bhubaneswar is in India.,1,Bhubaneswar,India,India,True,False,True
Alice: The city of Palembang is in Indonesia.,1,Palembang,Indonesia,Indonesia,True,False,True
Alice: The city of Palembang is in Brazil.,0,Palembang,Brazil,Indonesia,True,False,True
Alice: The city of Novokuznetsk is in China.,0,Novokuznetsk,China,Russia,True,False,True
Alice: The city of Izmir is in Turkey.,1,Izmir,Turkey,Turkey,True,False,True
Alice: The city of Lahore is in China.,0,Lahore,China,Pakistan,True,False,True
Alice: The city of Zhenjiang is in China.,1,Zhenjiang,China,China,True,False,True
Alice: The city of Zhaotong is in China.,1,Zhaotong,China,China,True,False,True
Alice: The city of Weifang is in Indonesia.,0,Weifang,Indonesia,China,True,False,True
Alice: The city of Tianjin is in Bangladesh.,0,Tianjin,Bangladesh,China,True,False,True
Alice: The city of Shaoxing is in the Philippines.,0,Shaoxing,the Philippines,China,True,False,True
Alice: The city of Hangzhou is in China.,1,Hangzhou,China,China,True,False,True
Alice: The city of Hangzhou is in Russia.,0,Hangzhou,Russia,China,True,False,True
Alice: The city of Anshan is in Cameroon.,0,Anshan,Cameroon,China,True,False,True
Alice: The city of Porto Velho is in Algeria.,0,Porto Velho,Algeria,Brazil,True,False,True
Alice: The city of N'Djamena is in China.,0,N'Djamena,China,Chad,True,False,True
Alice: The city of Kayseri is in Turkey.,1,Kayseri,Turkey,Turkey,True,False,True
Alice: The city of Marseille is in France.,1,Marseille,France,France,True,False,True
Alice: The city of Marseille is in Russia.,0,Marseille,Russia,France,True,False,True
Alice: The city of Giza is in Egypt.,1,Giza,Egypt,Egypt,True,False,True
Alice: The city of Giza is in India.,0,Giza,India,Egypt,True,False,True
Alice: The city of Mukalla is in Iran.,0,Mukalla,Iran,Yemen,True,False,True
Alice: The city of Lipetsk is in Russia.,1,Lipetsk,Russia,Russia,True,False,True
Alice: The city of Lipetsk is in China.,0,Lipetsk,China,Russia,True,False,True
Alice: The city of Tashkent is in Uzbekistan.,1,Tashkent,Uzbekistan,Uzbekistan,True,False,True
Alice: The city of Maturin is in Venezuela.,1,Maturin,Venezuela,Venezuela,True,False,True
Alice: The city of Maturin is in Saudi Arabia.,0,Maturin,Saudi Arabia,Venezuela,True,False,True
Alice: The city of Hanoi is in Vietnam.,1,Hanoi,Vietnam,Vietnam,True,False,True
Alice: The city of Hanoi is in Poland.,0,Hanoi,Poland,Vietnam,True,False,True
Alice: The city of Xuzhou is in Mexico.,0,Xuzhou,Mexico,China,True,False,True
Alice: The city of Cucuta is in Colombia.,1,Cucuta,Colombia,Colombia,True,False,True
Alice: The city of Cucuta is in India.,0,Cucuta,India,Colombia,True,False,True
Alice: The city of Santo Domingo Oeste is in Zambia.,0,Santo Domingo Oeste,Zambia,the Dominican Republic,True,False,True
Alice: The city of Neijiang is in China.,1,Neijiang,China,China,True,False,True
Alice: The city of Neijiang is in Ghana.,0,Neijiang,Ghana,China,True,False,True
Alice: The city of Yiwu is in India.,0,Yiwu,India,China,True,False,True
Alice: The city of Qiqihar is in China.,1,Qiqihar,China,China,True,False,True
Alice: The city of Qiqihar is in India.,0,Qiqihar,India,China,True,False,True
Alice: The city of Baotou is in China.,1,Baotou,China,China,True,False,True
Alice: The city of Aparecida de Goiania is in Brazil.,1,Aparecida de Goiania,Brazil,Brazil,True,False,True
Alice: The city of Kinshasa is in Brazil.,0,Kinshasa,Brazil,the Democratic Republic of the Congo,True,False,True
Alice: The city of Ciudad Nezahualcoyotl is in Mexico.,1,Ciudad Nezahualcoyotl,Mexico,Mexico,True,False,True
Alice: The city of Ciudad Nezahualcoyotl is in Senegal.,0,Ciudad Nezahualcoyotl,Senegal,Mexico,True,False,True
Alice: The city of Mexicali is in South Africa.,0,Mexicali,South Africa,Mexico,True,False,True
Alice: The city of Ciudad Juarez is in Mexico.,1,Ciudad Juarez,Mexico,Mexico,True,False,True
Alice: The city of Ciudad Juarez is in India.,0,Ciudad Juarez,India,Mexico,True,False,True
Alice: The city of Kampung Baru Subang is in Malaysia.,1,Kampung Baru Subang,Malaysia,Malaysia,True,False,True
Alice: The city of Maputo is in Mozambique.,1,Maputo,Mozambique,Mozambique,True,False,True
Alice: The city of Kumamoto is in Japan.,1,Kumamoto,Japan,Japan,True,False,True
Alice: The city of Kumamoto is in China.,0,Kumamoto,China,Japan,True,False,True
Alice: The city of Vilnius is in Lithuania.,1,Vilnius,Lithuania,Lithuania,True,False,True
Alice: The city of Vilnius is in China.,0,Vilnius,China,Lithuania,True,False,True
Alice: The city of Ranchi is in Venezuela.,0,Ranchi,Venezuela,India,True,False,True
Alice: The city of Jalandhar is in India.,1,Jalandhar,India,India,True,False,True
Alice: The city of Jalandhar is in Iraq.,0,Jalandhar,Iraq,India,True,False,True
Alice: The city of Bhayandar is in China.,0,Bhayandar,China,India,True,False,True
Alice: The city of Bareilly is in India.,1,Bareilly,India,India,True,False,True
Alice: The city of Bareilly is in Mozambique.,0,Bareilly,Mozambique,India,True,False,True
Alice: The city of Santo Domingo Este is in the Dominican Republic.,1,Santo Domingo Este,the Dominican Republic,the Dominican Republic,True,False,True
Alice: The city of Santo Domingo Este is in India.,0,Santo Domingo Este,India,the Dominican Republic,True,False,True
Alice: The city of Al Fayyum is in Egypt.,1,Al Fayyum,Egypt,Egypt,True,False,True
Alice: The city of Rizhao is in Iraq.,0,Rizhao,Iraq,China,True,False,True
"Alice: The city of Mianzhu, Deyang, Sichuan is in China.",1,"Mianzhu, Deyang, Sichuan",China,China,True,False,True
"Alice: The city of Mianzhu, Deyang, Sichuan is in India.",0,"Mianzhu, Deyang, Sichuan",India,China,True,False,True
Alice: The city of Jabalpur is in India.,1,Jabalpur,India,India,True,False,True
Alice: The city of Jabalpur is in Ukraine.,0,Jabalpur,Ukraine,India,True,False,True
Alice: The city of Bilimora is in India.,1,Bilimora,India,India,True,False,True
Alice: The city of Accra is in Ghana.,1,Accra,Ghana,Ghana,True,False,True
Alice: The city of Bogor is in Indonesia.,1,Bogor,Indonesia,Indonesia,True,False,True
Alice: The city of Bogor is in South Korea.,0,Bogor,South Korea,Indonesia,True,False,True
Alice: The city of Nyala is in Sudan.,1,Nyala,Sudan,Sudan,True,False,True
Alice: The city of Eskisehir is in China.,0,Eskisehir,China,Turkey,True,False,True
Alice: The city of Antalya is in Turkey.,1,Antalya,Turkey,Turkey,True,False,True
Alice: The city of Antalya is in Germany.,0,Antalya,Germany,Turkey,True,False,True
Alice: The city of Irkutsk is in Morocco.,0,Irkutsk,Morocco,Russia,True,False,True
Alice: The city of Libreville is in the United States.,0,Libreville,the United States,Gabon,True,False,True
Alice: The city of Santiago de los Caballeros is in the Dominican Republic.,1,Santiago de los Caballeros,the Dominican Republic,the Dominican Republic,True,False,True
Alice: The city of Santiago de los Caballeros is in India.,0,Santiago de los Caballeros,India,the Dominican Republic,True,False,True
Alice: The city of Nashik is in India.,1,Nashik,India,India,True,False,True
Alice: The city of Nashik is in China.,0,Nashik,China,India,True,False,True
Alice: The city of Karol Bagh is in India.,1,Karol Bagh,India,India,True,False,True
Alice: The city of Orumiyeh is in Saudi Arabia.,0,Orumiyeh,Saudi Arabia,Iran,True,False,True
Alice: The city of Zahedan is in Iran.,1,Zahedan,Iran,Iran,True,False,True
Alice: The city of Xuchang is in China.,1,Xuchang,China,China,True,False,True
Alice: The city of Changde is in Mexico.,0,Changde,Mexico,China,True,False,True
Alice: The city of Jilin is in China.,1,Jilin,China,China,True,False,True
Alice: The city of Manaus is in Turkey.,0,Manaus,Turkey,Brazil,True,False,True
Alice: The city of Jaboatao dos Guararapes is in Brazil.,1,Jaboatao dos Guararapes,Brazil,Brazil,True,False,True
Alice: The city of Jaboatao dos Guararapes is in Myanmar.,0,Jaboatao dos Guararapes,Myanmar,Brazil,True,False,True
Alice: The city of Kakamega is in Kenya.,1,Kakamega,Kenya,Kenya,True,False,True
Alice: The city of Kakamega is in Russia.,0,Kakamega,Russia,Kenya,True,False,True
Alice: The city of Agadir is in Bangladesh.,0,Agadir,Bangladesh,Morocco,True,False,True
Alice: The city of Ulan Bator is in Mongolia.,1,Ulan Bator,Mongolia,Mongolia,True,False,True
Alice: The city of Muscat is in Bangladesh.,0,Muscat,Bangladesh,Oman,True,False,True
Alice: The city of Paranaque City is in the Philippines.,1,Paranaque City,the Philippines,the Philippines,True,False,True
Alice: The city of Balikpapan is in Japan.,0,Balikpapan,Japan,Indonesia,True,False,True
Alice: The city of Ulyanovsk is in Russia.,1,Ulyanovsk,Russia,Russia,True,False,True
Alice: The city of Ulyanovsk is in Ukraine.,0,Ulyanovsk,Ukraine,Russia,True,False,True
Alice: The city of Kota Bharu is in Malaysia.,1,Kota Bharu,Malaysia,Malaysia,True,False,True
Alice: The city of Kota Bharu is in Norway.,0,Kota Bharu,Norway,Malaysia,True,False,True
Alice: The city of Sarajevo is in Bosnia and Herzegovina.,1,Sarajevo,Bosnia and Herzegovina,Bosnia and Herzegovina,True,False,True
Alice: The city of Maceio is in China.,0,Maceio,China,Brazil,True,False,True
Alice: The city of Joao Pessoa is in South Africa.,0,Joao Pessoa,South Africa,Brazil,True,False,True
Alice: The city of Zhangye is in China.,1,Zhangye,China,China,True,False,True
Alice: The city of Zhangye is in Venezuela.,0,Zhangye,Venezuela,China,True,False,True
Alice: The city of Xuanzhou is in China.,1,Xuanzhou,China,China,True,False,True
Alice: The city of Wuhan is in China.,1,Wuhan,China,China,True,False,True
Alice: The city of Luancheng is in China.,1,Luancheng,China,China,True,False,True
Alice: The city of Luancheng is in Brazil.,0,Luancheng,Brazil,China,True,False,True
Alice: The city of Liuzhou is in China.,1,Liuzhou,China,China,True,False,True
Alice: The city of Bijie is in China.,1,Bijie,China,China,True,False,True
Alice: The city of Bijie is in Indonesia.,0,Bijie,Indonesia,China,True,False,True
Alice: The city of Zhoushan is in the Philippines.,0,Zhoushan,the Philippines,China,True,False,True
Alice: The city of Hegang is in China.,1,Hegang,China,China,True,False,True
Alice: The city of E'zhou is in China.,1,E'zhou,China,China,True,False,True
Alice: The city of E'zhou is in Malaysia.,0,E'zhou,Malaysia,China,True,False,True
Alice: The city of Bucharest is in Romania.,1,Bucharest,Romania,Romania,True,False,True
Alice: The city of Ansan-si is in South Korea.,1,Ansan-si,South Korea,South Korea,True,False,True
Alice: The city of Ansan-si is in Canada.,0,Ansan-si,Canada,South Korea,True,False,True
Alice: The city of Oyo is in China.,0,Oyo,China,Nigeria,True,False,True
Alice: The city of Kano is in China.,0,Kano,China,Nigeria,True,False,True
Alice: The city of Bahawalpur is in Pakistan.,1,Bahawalpur,Pakistan,Pakistan,True,False,True
Alice: The city of New Kingston is in Jamaica.,1,New Kingston,Jamaica,Jamaica,True,False,True
Alice: The city of Pyongyang is in Argentina.,0,Pyongyang,Argentina,North Korea,True,False,True
Alice: The city of Shymkent is in China.,0,Shymkent,China,Kazakhstan,True,False,True
Alice: The city of Tlalpan is in Egypt.,0,Tlalpan,Egypt,Mexico,True,False,True
Alice: The city of Kemerovo is in India.,0,Kemerovo,India,Russia,True,False,True
Alice: The city of Zaporizhzhya is in South Korea.,0,Zaporizhzhya,South Korea,Ukraine,True,False,True
Alice: The city of Aguascalientes is in Mexico.,1,Aguascalientes,Mexico,Mexico,True,False,True
Alice: The city of Aguascalientes is in China.,0,Aguascalientes,China,Mexico,True,False,True
Alice: The city of Warri is in Nigeria.,1,Warri,Nigeria,Nigeria,True,False,True
Alice: The city of Warri is in China.,0,Warri,China,Nigeria,True,False,True
Alice: The city of Peshawar is in Tanzania.,0,Peshawar,Tanzania,Pakistan,True,False,True
Alice: The city of Kagoshima is in India.,0,Kagoshima,India,Japan,True,False,True
Alice: The city of Hamamatsu is in Russia.,0,Hamamatsu,Russia,Japan,True,False,True
Alice: The city of Cheongju-si is in South Korea.,1,Cheongju-si,South Korea,South Korea,True,False,True
Alice: The city of Ghaziabad is in South Korea.,0,Ghaziabad,South Korea,India,True,False,True
Alice: The city of Cochin is in India.,1,Cochin,India,India,True,False,True
Alice: The city of Ahmedabad is in India.,1,Ahmedabad,India,India,True,False,True
Alice: The city of Sulaymaniyah is in Iraq.,1,Sulaymaniyah,Iraq,Iraq,True,False,True
Alice: The city of Hamadan is in Iran.,1,Hamadan,Iran,Iran,True,False,True
Alice: The city of Hamadan is in Pakistan.,0,Hamadan,Pakistan,Iran,True,False,True
Alice: The city of Stockholm is in Russia.,0,Stockholm,Russia,Sweden,True,False,True
Alice: The city of Siliguri is in China.,0,Siliguri,China,India,True,False,True
Alice: The city of Al Basrah al Qadimah is in Iraq.,1,Al Basrah al Qadimah,Iraq,Iraq,True,False,True
Alice: The city of Krakow is in South Korea.,0,Krakow,South Korea,Poland,True,False,True
Alice: The city of Bandar Lampung is in Indonesia.,1,Bandar Lampung,Indonesia,Indonesia,True,False,True
Alice: The city of Bandar Lampung is in South Africa.,0,Bandar Lampung,South Africa,Indonesia,True,False,True
Alice: The city of Can Tho is in Venezuela.,0,Can Tho,Venezuela,Vietnam,True,False,True
Alice: The city of Bouake is in China.,0,Bouake,China,Côte d'Ivoire,True,False,True
Alice: The city of Abobo is in Côte d'Ivoire.,1,Abobo,Côte d'Ivoire,Côte d'Ivoire,True,False,True
Alice: The city of Abobo is in India.,0,Abobo,India,Côte d'Ivoire,True,False,True
Alice: The city of Shihezi is in China.,1,Shihezi,China,China,True,False,True
Alice: The city of Yunfu is in China.,1,Yunfu,China,China,True,False,True
Alice: The city of Yunfu is in Honduras.,0,Yunfu,Honduras,China,True,False,True
Alice: The city of Xiangtan is in China.,1,Xiangtan,China,China,True,False,True
Alice: The city of Xiangtan is in Brazil.,0,Xiangtan,Brazil,China,True,False,True
Alice: The city of Qionghai is in China.,1,Qionghai,China,China,True,False,True
Alice: The city of Tembisa is in South Africa.,1,Tembisa,South Africa,South Africa,True,False,True
Alice: The city of Tembisa is in the Philippines.,0,Tembisa,the Philippines,South Africa,True,False,True
Alice: The city of Puente Alto is in Chile.,1,Puente Alto,Chile,Chile,True,False,True
Alice: The city of Puente Alto is in China.,0,Puente Alto,China,Chile,True,False,True
Alice: The city of Zhengzhou is in China.,1,Zhengzhou,China,China,True,False,True
Alice: The city of Zhengzhou is in Brazil.,0,Zhengzhou,Brazil,China,True,False,True
Alice: The city of Ya'an is in China.,1,Ya'an,China,China,True,False,True
Alice: The city of Ya'an is in Morocco.,0,Ya'an,Morocco,China,True,False,True
Alice: The city of Xianyang is in China.,1,Xianyang,China,China,True,False,True
Alice: The city of Weihai is in China.,1,Weihai,China,China,True,False,True
Alice: The city of Bengbu is in China.,1,Bengbu,China,China,True,False,True
Alice: The city of Bengbu is in India.,0,Bengbu,India,China,True,False,True
Alice: The city of Mississauga is in India.,0,Mississauga,India,Canada,True,False,True
Alice: The city of Yerevan is in Armenia.,1,Yerevan,Armenia,Armenia,True,False,True
Alice: The city of Albuquerque is in the United States.,1,Albuquerque,the United States,the United States,True,False,True
Alice: The city of Albuquerque is in Egypt.,0,Albuquerque,Egypt,the United States,True,False,True
Alice: The city of Calgary is in India.,0,Calgary,India,Canada,True,False,True
Alice: The city of Bobo-Dioulasso is in China.,0,Bobo-Dioulasso,China,Burkina Faso,True,False,True
Alice: The city of Florianopolis is in Brazil.,1,Florianopolis,Brazil,Brazil,True,False,True
Alice: The city of Cuiaba is in Brazil.,1,Cuiaba,Brazil,Brazil,True,False,True
Alice: The city of Chattogram is in China.,0,Chattogram,China,Bangladesh,True,False,True
Alice: The city of Nanjing is in China.,1,Nanjing,China,China,True,False,True
Alice: The city of Heze is in China.,1,Heze,China,China,True,False,True
Alice: The city of Jeonju is in South Korea.,1,Jeonju,South Korea,South Korea,True,False,True
Alice: The city of Almaty is in Kazakhstan.,1,Almaty,Kazakhstan,Kazakhstan,True,False,True
Alice: The city of Almaty is in Iraq.,0,Almaty,Iraq,Kazakhstan,True,False,True
Alice: The city of Pimpri is in China.,0,Pimpri,China,India,True,False,True
Alice: The city of Navi Mumbai is in India.,1,Navi Mumbai,India,India,True,False,True
Alice: The city of Navi Mumbai is in China.,0,Navi Mumbai,China,India,True,False,True
Alice: The city of Novosibirsk is in the Philippines.,0,Novosibirsk,the Philippines,Russia,True,False,True
Alice: The city of Goeteborg is in South Korea.,0,Goeteborg,South Korea,Sweden,True,False,True
Alice: The city of Bursa is in Turkey.,1,Bursa,Turkey,Turkey,True,False,True
Alice: The city of Dar es Salaam is in Tanzania.,1,Dar es Salaam,Tanzania,Tanzania,True,False,True
Alice: The city of Dar es Salaam is in Italy.,0,Dar es Salaam,Italy,Tanzania,True,False,True
Alice: The city of Mbuji-Mayi is in Pakistan.,0,Mbuji-Mayi,Pakistan,the Democratic Republic of the Congo,True,False,True
Alice: The city of Goiania is in China.,0,Goiania,China,Brazil,True,False,True
Alice: The city of Kigali is in Indonesia.,0,Kigali,Indonesia,Rwanda,True,False,True
Alice: The city of Diyarbakir is in Turkey.,1,Diyarbakir,Turkey,Turkey,True,False,True
Alice: The city of Tyumen is in Russia.,1,Tyumen,Russia,Russia,True,False,True
Alice: The city of Tyumen is in Mexico.,0,Tyumen,Mexico,Russia,True,False,True
Alice: The city of Orenburg is in Malaysia.,0,Orenburg,Malaysia,Russia,True,False,True
Alice: The city of Osaka is in Japan.,1,Osaka,Japan,Japan,True,False,True
Alice: The city of Osaka is in India.,0,Osaka,India,Japan,True,False,True
Alice: The city of Sapporo is in Japan.,1,Sapporo,Japan,Japan,True,False,True
Alice: The city of Cheonan is in South Korea.,1,Cheonan,South Korea,South Korea,True,False,True
Alice: The city of Cheonan is in Myanmar.,0,Cheonan,Myanmar,South Korea,True,False,True
Alice: The city of Culiacan is in Mexico.,1,Culiacan,Mexico,Mexico,True,False,True
Alice: The city of General Santos is in the Philippines.,1,General Santos,the Philippines,the Philippines,True,False,True
Alice: The city of Ebute Ikorodu is in Nigeria.,1,Ebute Ikorodu,Nigeria,Nigeria,True,False,True
Alice: The city of Ebute Ikorodu is in China.,0,Ebute Ikorodu,China,Nigeria,True,False,True
Alice: The city of Benin City is in Nigeria.,1,Benin City,Nigeria,Nigeria,True,False,True
Alice: The city of Kanpur is in Brazil.,0,Kanpur,Brazil,India,True,False,True
Alice: The city of Indore is in India.,1,Indore,India,India,True,False,True
Alice: The city of Indore is in Turkey.,0,Indore,Turkey,India,True,False,True
Alice: The city of Zunyi is in Senegal.,0,Zunyi,Senegal,China,True,False,True
Alice: The city of Wenzhou is in China.,1,Wenzhou,China,China,True,False,True
Alice: The city of Luohe is in Brazil.,0,Luohe,Brazil,China,True,False,True
Alice: The city of Cixi is in China.,1,Cixi,China,China,True,False,True
Alice: The city of Hanzhong is in China.,1,Hanzhong,China,China,True,False,True
Alice: The city of Hanzhong is in Iran.,0,Hanzhong,Iran,China,True,False,True
Alice: The city of Guangzhou is in China.,1,Guangzhou,China,China,True,False,True
Alice: The city of Guangzhou is in India.,0,Guangzhou,India,China,True,False,True
